outputs/olap/pivot_category_city.csv

category,BTM,Banashankari,Bannerghatta Road,Basavanagudi,Bellandur,Brigade Road,Brookefield,Church Street,Electronic City,Frazer Town,HSR,Indiranagar,JP Nagar,Jayanagar,Kalyan Nagar,Kammanahalli,Koramangala 4th Block,Koramangala 5th Block,Koramangala 6th Block,Koramangala 7th Block,Lavelle Road,MG Road,Malleshwaram,Marathahalli,New BEL Road,Old Airport Road,Rajajinagar,Residency Road,Sarjapur Road,Whitefield
Buffet,4.19,3.84,3.82,3.86,3.98,3.87,3.79,3.7,3.72,,3.93,4.09,,4.05,4.2,,4.0,,,,3.92,,4.13,4.16,4.13,3.5,3.96,,,
Cafes,4.04,3.77,3.67,3.8,3.78,3.9,3.64,4.07,3.54,3.63,3.76,3.84,3.7,3.64,3.82,,3.73,2.9,3.7,3.2,3.78,3.7,3.81,3.46,3.67,3.6,3.33,3.0,3.95,3.87
Delivery,3.67,3.66,3.55,3.69,3.57,3.72,3.53,3.63,3.46,3.64,3.5,3.61,3.39,3.58,3.57,3.52,3.61,3.62,3.51,3.76,3.73,3.35,3.64,3.45,3.54,3.47,3.54,3.43,3.53,3.55
Desserts,3.74,3.64,3.5,4.01,3.59,3.71,3.57,3.63,3.29,3.85,3.7,3.65,3.4,3.59,3.61,3.55,3.83,4.03,3.2,3.52,3.73,,3.73,3.48,3.73,3.82,3.6,3.2,3.52,3.92
Dine-out,3.64,3.63,3.4,3.59,3.47,3.79,3.63,3.82,3.47,3.43,3.69,3.75,3.6,3.66,3.52,3.5,3.65,3.53,3.74,3.56,3.59,3.52,3.74,3.59,3.59,3.64,3.46,3.4,3.48,3.6
Drinks & nightlife,,,,,,4.1,,,,,,3.9,,4.5,,,,,,4.1,,,,,,,3.7,,,2.5
Pubs and bars,,,,,,3.87,,,,,,3.2,,,,,,,,,,,,,,,,,,

DOCUMENTATION.md

### 6.6 Top 10 Primary Cuisines

Identifies Bangalore's market leaders in culinary offerings:
1. **North Indian** (2,272 restaurants, avg cost ₹586.22, avg rating 3.54)
2. **South Indian** (991 restaurants, avg cost ₹332.41, avg rating 3.57)
3. **Biryani** (578 restaurants, avg cost ₹441.78, avg rating 3.48)
4. **Cafe** (571 restaurants, avg cost ₹626.80, avg rating 3.77)
5. **Chinese** (550 restaurants, avg cost ₹594.73, avg rating 3.58)